entertainment,સાડીમાં જ દેખાતી 'નાગિન 3' ની એક્ટ્રેસનો જુઓ બોલ્ડ અવતાર
business,"RBI VS કેન્દ્રઃ ઉર્જિત પટેલ PMને મળ્યા, વિવાદના સમાધાન માટે બની ફોર્મ્યુલા"
entertainment,Sanju : આ રીતે દિવસે દિવસે સંજય દત્તનાં રૂપમાં ઢળતો ગયો રણબીર કપૂર
entertainment,ભારતમાં વ્હોટ્સએપથી વધુ ડાઉનલોડ થાય છે આ એપ્લિકેશન!
tech,"flipkart પર ધમાકેદાર ઓફર,  Xiaomi Mi A1 અને iPhone 8 પર મળી રહ્યું છે મોટુ ડિસ્કાઉન્ટ"
tech,VIDEO: તમે ક્યારે પણ લાકડાની બાઈક જોઈ છે? જુઓ આ ભાઈની કમાલ
business,કેશનું ટેંશન દૂર કરવા માટે SBIએ ફીમાં શરૂ કરી આ સર્વિસ!
entertainment,સુસ્મિતા સેને લગ્ન અંગે કહી એવી વાત કે સોશિયલ મીડિયામાં થઇ ટ્રોલ
tech,સસ્તા થયા Nokiaના આ ત્રણ કેમેરાવાળા સ્માર્ટફોન
entertainment,વર્કઆઉટ બાદ જીમની બહાર સ્પોટ થઇ બોલિવૂડ હસીનાઓ
business,દુનિયાનો પહેલો ફોલ્ડ થઇ શકે તેવો સ્માર્ટફોન!
entertainment,"કર્ણાટકનાં CM બનશે HD કુમારસ્વામી પણ પત્ની ગૂગલ પર થઇ રહી છે ટ્રેન્ડ, આ છે કારણ!"
entertainment,"રાત્રે 3.30 વાગ્યે સલમાનને મળવા પહોંચ્યો રેમો ડિસૂઝા, શું હતું કારણ?"
business,એક જ દિવસમાં રૂ. 75000 કરોડથી પણ વધારે વધી ગઈ આ માણસની સંપત્તિ
entertainment,"'જે સંજૂ કેન્સરની શિકાર તેની પત્નીનો ન થયો, તે માધુરીને શું થશે'"
entertainment,"વરરાજા બન્યો આનંદ આહુજા, જુઓ લગ્નની તૈયારીઓની તસવીરો"
entertainment,"સોશિયલ મીડિયા પર ઉડી 'રેસ-3'નાં ટ્રેલરની મજાક, લોકો બોલ્યા- 'આ તો કોપી છે'"
entertainment,"સની લિયોન તેની જ એક ટેવથી પરેશાન, દર 15 મિનિટે કરે છે આવું કામ!"
entertainment,"Hotness Alert: ટીવીની સંસ્કારી વહુએ છોડી શરમ, તસવીરોમાં બતાવ્યો બોલ્ડ અંદાજ"
entertainment,અમેરિકન છાપાએ મધુબાલાને યાદ કરી કંઈક અલગ અંદાજમાં
tech,Nokiaના આ લેટેસ્ટ બજેટ સ્માર્ટફોનના પ્રી-બુકિંગ ઉપર મેળવો રૂ.1800નું કેશબેક
tech,"સેમસંગ Galaxy S સિરીઝના ફોન ખરીદો 7,499 રુપિયામાં"
entertainment,"સોનમ-આનંદનાં લગ્નની ન જોયેલી તસવીરો, વારંવાર જોવાનું થશે મન"
business,ખુશખબર: 1 એપ્રિલથી રેલવે ટિકિટ સહિત આ વસ્તુઓ થશે સસ્તી
business,ઓફર! અહીં તમે ફ્રીમાં કરાવી શકશો હોમ લોન ટ્રાન્સફર
entertainment,"URIની Box Office પર 'સર્જિકલ સ્ટ્રાઇક', 200 કરોડને પાર"
business,"આસામ ગ્લોબલ ઇન્વેસ્ટર્સ સમિટમાં રિલાયન્સ ગ્રુપના મુકેશ અંબાણીએ શું કહ્યું, જાણો"
tech,"આ સ્માર્ટ ટીવી પર મળી રહ્યું છે જબરદસ્ત કેશબેક, આકર્ષક EMI પણ આપી રહી છે કંપની"
entertainment,ઓન સ્ક્રીન PM મોદીની ભૂમિકા નિભાવશે આ એક્ટર
tech,"આજે લોન્ચ થશે NOKIAનો જોરદાર સ્માર્ટફોન, બે દિવસ ચાલશે બેટરી"
entertainment,લગ્નની ખુશી મનાવી રહેલા રણવીરસિંહ માટે આવ્યા ખરાબ સમાચાર
tech,"નોકિયાએ ભારતમાં લોન્ચ કર્યા આ બે સ્માર્ટફોન, આટલી છે કિંમત"
entertainment,Thackeray Movie Review: શું નવાઝુદ્દીનની મહેનત રંગ લાવશે?
business,"સસ્તી દાળ માટે હજુ રાહ જોવી પડશે!,સરકારની બેઠક બાદ પ્રતિકિલો 30 રૂપિયાના ઘટાડાના સંકેત"
entertainment,એક ટુ વ્હીલર આવી જાય તેટલું મોઘું ટ્રેક પહેરીને રણબીર જાય છે જીમ
business,"CNBC-TV 18 ના ""ઇન્ડિયા બિઝનેસ લિડર્સ એવોર્ડ""માં અરુણ જેટલી આપશે હાજરી"
business,"500 1000 રૂપિયાની નોટ ના સ્વીકારાતાં હંગામો, ટોલ નાકાએ ટ્રાફિક જામ, જુઓ તસ્વીરો"
entertainment,બાહુબલીને ટક્કર આપવા સની લિયોનીએ લીધો આ અવતાર..
business,"ટ્રંપને ભારતનો વળતો જવાબ, અમેરિકન ઉત્પાદન પર વધારી ઈમ્પોર્ટ ડ્યુટી"
business,TRAIના નવા ટેરિફથી ટીવી જોવાનો ખર્ચ 25% વધી શકે છે : રિપોર્ટ
entertainment,Photos: 'ઝલક દિખલા જા' ની રનર-અપ રહેલી એક્ટ્રેસે લગાવી 'આગ'
business,2020 સુધીમાં ભારતભરમાં હશે 4G: મુકેશ અંબાણી
entertainment,"સપના ચૌધરીએ ખરીદી એટલી મોંઘી કાર, કિંમત જાણી તમને પણ થશે આશ્ચર્ય"
entertainment,"કુવૈતમાં અદનાન સામીનાં સ્ટાફનું 'ઇન્ડિયન ડોગ્સ' કહી અપમાન, સુષમાએ કરી ત્વરિત કાર્યવાહી"
tech,"હવે WhatsAppથી મોકલી શકશો પૈસા, ટૂંક સમયમાં શરૂ થશે આ સેવા"
entertainment,ફિલ્મ સ્ટૂડિયોની બહાર જોવા મળ્યો બેબોની અદાઓનો જલવો
entertainment,"જ્યારે નરગિસ બોલી- 'ના, હું દિલીપ કુમારની મા નથી બની શકતી'"
business,"શેર બજાર કડડભૂસ, સેન્સેક્સ-નિફ્ટીમાં ભારે ઘટાડો"
business,"યૂનિવર્સલ બેઝિક ઇનકમ વિશે ચિદમ્બરમે કહ્યુ, ફક્ત ગરીબોને મળશે ફાયદો"
entertainment,"કપિલ શર્માના સપોર્ટમાં આવી શિલ્પા શિંદે, કરી આ આજીજી"
business,"GST કાઉન્સિલની બેઠકમાં લેવાયા 4 મોટા નિર્ણય, જાણો કોને શું મળ્યું"
business,"તમારી બેંક કાર્ડની માહિતી વિદેશમાં થઇ રહી છે સ્ટોર, ખુલ્લેઆમ નિયમોનો ભંગ"
tech,અહીં મળી રહી છે 2 હજારની ઘડિયાળ માત્ર 570માં
entertainment,"જુઓ, ટીવીની આ હોટ એકટ્રેસનો બોલ્ડ અવતાર"
business,બજારમાં 'રોકડ જ રાજા'  નોટબંધી નિષ્ફળ: માર્કેટમાં 1.25 લાખ કરોડની રોકડ વધી
business,"આ 5 કારણોથી બેંકનો ચેક થાય છે રિજેક્ટ, ભૂલથી પણ ન કરો આવી ગફલત"
entertainment,"વિરાટની સેન્ચુરી પર અનુષ્કા ખુશ, ઇન્સ્ટાગ્રામ પર આવી રીતે વરસાવ્યો પ્રેમ"
tech,"Jio યૂઝર્સને દરરોજ મળી રહ્યો છે ફ્રીમાં એક્સ્ટ્રા 2GB ડેટા, આ રીતે ઉઠાવો લાભ"
tech,"આ સ્માર્ટફોન પર મળી રહ્યું છે 8,000 રૂપિયાનું ડિસ્કાઉન્ટ"
tech,"જુઓ ઉડતી કાર, જે બની છે રોકેટના એન્જિનથી"
entertainment,'ભારત' ફિલ્મમાં આ વ્યકિતનો રોલ ભજવશે સલમાન
business,"SBIની હોમ લોન્સ સૌથી સસ્તી થઈ, વ્યાજદરમાં 5 બેઝિસ પોઇન્ટનો થયો ઘટાડો"
business,"દેશની 9 સરકારી બેંક બંધ કરશે તેમની બ્રાન્ચ, સરકારને સોંપાયો નવો પ્લાન!"
business,"અમદાવાદ : એક્સાઇઝ ડ્યુટીના વિરોધમાં વેપારીઓના ઉપવાસ, જોવો Video"
tech,"હવે સીલિંગ ફેનને પણ મોબાઇલથી કરી શકશો કંન્ટ્રોલ, જાણો કેવી રીતે"
entertainment,"ફિટ રહેવા માટે હસિનાઓ આ રીતે કરે છે એક્સરસાઇઝ, Videoમાં જુઓ તેમની મહેનત"
tech,"12 ડિસેમ્બરે સસ્તા મળશે Samsung સ્માર્ટફોન, જાણો ટોપ ડિલ્સ"
entertainment,લાંબા સમય બાદ પ્રિયંકા ચોપરાએ કરાવ્યું ખાસ Photoshoot
tech,"ફોન બંધ છે તો પણ હેકર્સ ઉઠાવી શકે છે તમારા એકાઉન્ટમાંથી પૈસા, જાણો કેવી રીતે"
entertainment,"ફોટોગ્રાફ્સ પર ગુસ્સે ભરાયો અબરામ, ચીડાઇને બોલ્યો- 'નો પિક્ચર્સ'"
entertainment,બોલિવૂડ એક્ટ્રેસિસે બ્રાઇડિયલ કલેક્શન પહેરીને રેમ્પ પર વિખેર્યા જલવા
tech,'Summer Fest'માં 51% ડિસ્કાઉન્ટ સાથે મળી રહ્યા છે સેમસંગના પ્રોડક્ટ્સ
entertainment,Viral pics: આઈલેન્ડ પર લિપલોક કરતી જોવા મળી આ એક્ટ્રેસ
business,"ઘીના ગોરખધંધાનો પર્દાફાશ, પ્રદેશ18 ઇટીવીના અહેવાલથી ફુડ વિભાગનો રાજ્યભરમાં સપાટો"
business,શું તમે ધો-8 પાસ છો? પોસ્ટ ઓફિસની ફ્રેન્ચાઇઝી લઈને કરો મોટી કમાણી
entertainment,પાકિસ્તાનની આ પોર્ન સ્ટાર હિઝાબ પહેરી કરે છે સેક્સ અભિનય
entertainment,"CONFIRM:'ઉલ્ટા ચશ્મા..'માં પાછી ફરી દયાબેન, શૂટિંગ કર્યુ શરૂ"
entertainment,"Total Dhamaal: 'મુંગડા' ગીત રીલિઝ, સોનાક્ષીના ઠુમકા કરશે ઘાયલ"
business,"પેટ્રોલ-ડિઝલ થયુ 2 રૂપિયા સસ્તુ, સરકારે ઘટાડી એક્સાઇઝ ડ્યૂટી"
entertainment,"નથી રોકાઇ રહ્યો આ એક્ટ્રેસની બોલ્ડ તસવીરનો સિલસિલો, બિકીનીમાં લગાવી આગ"
entertainment,"આયુષ્માને ખોલી ભૂમિની પોલ, એક ક્લાક પણ સેક્સ વગર નથી રહી શકતી તે!"
entertainment,"અનુષ્કા શર્મા અહીં મનાવશે વિરાટ કોહલીનો જન્મદિવસ, જુઓ તસવીરો"
entertainment,"Juicy Linkup: સગાઈની અફવા વચ્ચે પરત ફર્યા રણવીર-દીપિકા, સંબંધો પર લાગી મહોર!"
business,રાહતઃ ક્રુડ ઓઇલ ઉંચકાયુ છતાં પેટ્રોલ-ડીઝલના ભાવ નહીં વધે!
tech,"લોન્ચ થયો Nokia X5, વાંચો આ બજેટ ફોનમાં શું છે ખાસ"
tech,"E-mail હોય કે ચેટિંગ, તમારા અંગ્રેજીની તમામ ભૂલને સુધારશે આ એપ"
entertainment,"રસ્તા પર કપડાં વિના દોડી હતી આ અભિનેત્રી, પ્રેમમાં કર્યું હતું આવું"
entertainment,YearEnder2018: વર્ષની 30 સૌથી રોમાંચક KISS
tech,"NOKIAએ લોન્ચ કર્યા 3 સ્માર્ટફોન, ઓછી કિંમતમાં જબરદસ્ત છે ફિચર"
business,"ફોર્બ્સની ""ગ્લોબલ ગેમ ચેજર્સ"" લિસ્ટમાં નં 1પર મુકેશ અંબાણી"
entertainment,"સંજય દત્તની સાથે ડેબ્યૂ કરનારી આ હિરોઇન, ફિલ્મો કરતાં વધુ PHOTOSને કારણે છે ચર્ચામાં"
tech,"મોબાઇલથી ઓપરેટ થશે Nikeના આ સ્માર્ટ શુઝ, દોરી પણ જાતે બંધાશે"
entertainment,"ઇલિયાના ડિક્રુઝ માણી રહી છે રજાઓ, શેર કરી મજાની તસવીરો"
business,"હવે, બેફિકર થઇને કરો સોશિયલ મીડિયા પર કોમેન્ટ, ભરાશો તો પણ ચિંતા નહીં!"
entertainment,"નવાં વર્ષે BB11ની કન્ટેસ્ટંટે શેર કર્યા બોલ્ડ ફોટો, મચાવી સનસનાટી"
business,"વિજય માલ્યા થયો દેશનો પહેલો ભાગેડુ આર્થિક અપરાધી, તમામ સંપત્તિ થશે કબજે"
business,મોદી સરકાની ભેટ! અડધી કિંમત પર મળી રહ્યો છે આ જમાનાનો ચૂલ્હો
entertainment,બિપાશાએ બિકિની પહેરીને સોશિયલ મીડિયા પર મચાવી સનસનાટી
business,"જીયો: સમય મર્યાદા વધારાઇ, હવે 15 એપ્રિલ સુધી પ્રાઇમ મેમ્બરશિપ લઇ શકાશે, 303 રૂપિયામાં 3 મહિના ફ્રી"
entertainment,"સલમાનનાં જીજાની 'લવરાત્રિ'નું ટિઝર રિલીઝ, જુઓ ગુજરાતી ગરબો 'છોગાડા તારા'ની રમઝટ"
entertainment,"સંજય દત્તની પુત્રીએ ઇન્સ્ટાગ્રામ પર પોસ્ટ કરી તસવીર, માન્યતાએ કરી કમેન્ટ"
entertainment,"આજની રાત પણ જેલમાં વિતાવશે સલમાન,જામીન પર થશે કાલે નિર્ણય"
business,અમદાવાદઃ આજથી રેલવે ટિકિટ રીફંડ માટે નવા નિયમો લાગુ
entertainment,"દીપિકાની ફેશન પર ફિદા હોલીવૂડ, નમસ્તે પોઝથી જીત્યુ સૌનું દિલ"
business,2000 રૂપિયાની નોટના પ્રિન્ટિંગ પર સરકારનું મોટું નિવેદન
business,દેશને સમર્પિત થનારી સૌથી લાંબી સુરંગમાં શું છે ખાસ જાણો
business,"SBI બાદ PNBએ વ્યાજ દર ઘટાડ્યાં, હોમ લોન સસ્તી થશે"
tech,"થાઈલેંડ ગુફામાં ફસાયેલા બાળકોને બચાવશે આ સબમરિન, આવી રીતે કરે છે કામ"
entertainment,'સંસ્કારી બહૂ'ની ઇમેજ તોડવા માટે 'ગોપી બહૂ'એ શેર કર્યા Bold Photos
tech,"આજે લોન્ચ થશે સેમસંગનો Galaxy Note 9, જાણો શું હશે ખાસ"
entertainment,KBC 10: જીતેલી રકમને બિસ્તર પર પાથરીને સુવા ઇચ્છે છે આ સ્પર્ધક
business,ઇરાન ન્યુક્લિયર ડીલ તુટવાની સંભાવનાએ ઓઇલના ભાવમાં થયો વધારો
business,"સરકારની આ યોજનાથી 11 કરોડ લોકોને થયો ફાયદો, શું તમે ઉઠાવ્યો આનો લાભ?"
business,GST: વન નેશન વન ટેક્સથી શું મોંઘું થશે? શું સસ્તું થશે? જાણો
entertainment,ટીવીની આ હોટ એક્ટ્રેસનો ફરી એકવાર જોવા મળ્યો બોલ્ડ અવતાર
tech,"28 નવેમ્બરે ભારતમાં લોન્ચ થશે નોકિયાનો નવો સ્માર્ટફોન, જાણો કિંમત અને ફિચર્સ"
tech,13 હજાર રૂપિયા સુધી સસ્તા થયા Nokiaના આ ચાર એન્ડ્રોયડ સ્માર્ટફોન
entertainment,"First Look: 'તાનાજી'માં આવું હશે અજય દેવગણનું કેરેક્ટર, જુઓ તસવીરો"
entertainment,સની લિયોને પતિ અને દીકરી સાથે શેર કરી ટોપલેસ તસવીર
business,"2000 રૂપિયા સુધી ક્રેડિટ, ડેબિટ કાર્ડની લેણદેણ પર નહીં લાગે સર્વિસ ટેક્સ"
business,'કોમરેડ' ગીતા કેવી રીતે બની IMFની ચિફ ઈકોનોમિસ્ટ
business,"આ 10 દેશો પાસે છે દુનિયાનું સૌથી વધુ સોનું, જાણો ભારત પાસે કેટલુ છે?"
tech,"ભારતમાં Flying Carનું સપનું થશે સાકાર, 2021માં થશે લોન્ચ"
business,"ઘરેલું એલપીજી સિલિન્ડરનાં ભાવમાં વધારો, ભાવ ચાર આંકડાને પાર!"
business,નવા જમાનાની ખેતીથી 8 લાખ કમાણી કરે છે આ કપિલદેવ
entertainment,"'HAPPY BIRTHDAY' કેટરીના કૈફ, જુઓ તેની બાળપણની સ્ટાઇલિશ તસવીરો"
tech,WhatsAppમાં ધમકી અને અભદ્ર મેસેજ મોકલનારની ખૈર નથી
entertainment,"""ઠગ્સ ઑફ હિન્દોસ્તાન""ને મળ્યું રૂ. 50 કરોડોનું બમ્પર એડવાન્સ બુકિંગ"
entertainment,પાકિસ્તાનમાં બચ્ચન અને માધુરી દિક્ષીત કરી રહ્યા છે ચૂંટણી પ્રચાર!
entertainment,કેમ અરબાઝ ખાન સાથે લીધા છૂટાછેડા? પહેલીવાર મલાઇકાએ કર્યો ખુલાસો
tech,"સેમસંગના આ સ્માર્ટફોન પર મળી રહી છે ભારે છૂટ, જાણો ક્યાંથી ખરીદશો"
entertainment,"મહેંદી સેરેમનીમાં પણ દુલ્હનથી કમ નથી લાગતી બોલિવૂડ હસીનાઓ, જુઓ તેમનો ઠાઠ"
business,"સપ્ટેમ્બરથી બદલાઈ જશે કાર-સ્કૂટરના વીમાના નિયમો, ચૂકવવા પડશે વધારે પૈસા"
tech,"જો કરી આ ભૂલ તો, WhatsApp થઇ શકે છે બ્લોક"
business,વિદ્યાર્થીઓ માટે SBIની ઝીરો બેલેન્સ ખાતા પર મળશે આ ફાયદા
business,"તહેવાર પહેલા એમેઝોન-ફ્લિપકાર્ટની ભેટ, ખરીદી પર મળશે બમ્પર છૂટ"
tech,"BSNL યૂઝર્સ થશે 4Gમાં અપગ્રેડ, આ રીતે મળશે Data બિલકુલ ફ્રી"
business,"SBI Alert! તમને આ મેસેજ આવ્યો હોય તો ફટાફટ કરો આ કામ, નહી તો લેવડ-દેવડ બંધ"
business,પાન કાર્ડને બેંક ખાતા સાથે લિંક કરવાની આજે છેલ્લી તારીખ
business,"ગુજરાત બજેટ 2017 : જુઓ, નાણામંત્રી નિતિન પટેલની બજેટ સ્પીચ"
entertainment,"જ્યારે સતીશ કૌશિકે ખોલ્યું તેમનાં જીવનનું રહસ્ય, કહ્યું- હું 'ગે' છુ!"
entertainment,નવાઝુદ્દીનની 'ઠાકરે'એ રીલિઝના પહેલાં દિવસે આટલા કરોડની કરી કમાણી
entertainment,"કોઈ અપ્સરાને પણ શરમાવે તેવી છે ટીવીની આ 'ચુડેલ', જુઓ Hot તસવીરો"
entertainment,2019માં શું 'ગલી બોય' કા ટાઇમ આયેગા? TRAILER જોઇને કરો નક્કી
tech,"1-2 લાખનું નહીં, પૂરા 3 કરોડ 50 લાખ રુપિયાનું છે આ ટીવી, જુઓ તસવીરો"
entertainment,ટીવીનાં પ્રખ્યાત 'જમાઇ'એ કરાવ્યું ન્યૂડ ફોટોશૂટ
entertainment,Teacher's Day પર રિતિક રોશને શેર કર્યુ 'Super 30'નું પહેલું પોસ્ટર
tech,"સુર્યની રોશનીથી બનશે ઇંધણ, થશે ઘરનું દરેક કામ"
business,"જાણો, દુનિયાના એ દેશો વિશે જ્યાં કોઈ ગરીબ નથી"
entertainment,"નાના-તનુશ્રી મામલે પરિણીતિનું નિવેદન, 'મારી સાથે થયુ હોત તો ચૂપ ન બેસતી...'"
entertainment,"Kasautii Zindagii Kay 2 : હિના ખાનનો ખુલાસો, આ કારણથી મળ્યો કોમોલિકાનો રોલ"
entertainment,75માં ગોલ્ડન ગ્લોબ એવોર્ડ્સનાં રેડ કારપેટ પર 'બ્લેક થીમ'માં ઉતર્યા સિતારા
entertainment,"સલમાનના ભાણેજનો વીડિયો વાઇરલ, નાના સલીમ ખાનની પીઠ પર કરી સવારી"
