entertainment,સાડીમાં જ દેખાતી 'નાગિન 3' ની એક્ટ્રેસનો જુઓ બોલ્ડ અવતાર
business,"ઇન્ફોસિસ સીઓઓના પગાર વધારાથી નારાયણમૂર્તિ ખફા, કહ્યું-કર્મચારીઓમાં વધશે અવિશ્વાસ"
business,"પાંચ મહિનાામાં સૌથી સસ્તું સોનું, ચાંદીની કિંમતોમાં 620 રૂપિયા ઘટાડો"
entertainment,"5 વર્ષનો થયો શાહરૂખનો પુત્ર, જુઓ અબરામ ખાનના સૌથી ક્યુટ Videos"
entertainment,"રણવીર-દીપિકાનું રિસેપ્શન કાર્ડ આવ્યું સામે, કંઇક આવી હશે પાર્ટી"
business,"Walmart-Flipkart થશે એકઃ કોણ હશે નવા ચેયરમેન, જાણો શું થશે ફેરફાર"
business,"જાણો શું છે GST, ટેક્ષમાં શું થશે ફાયદા-ગેરફાયદા"
entertainment,"કપિલના શોમાં કિકુએ કહ્યું- સલમાનનું ગીત ગાઇશ, તે શોનો પ્રોડ્યુસર છે"
business,દિવાળી પર કરો માત્ર રૂ.899માં હવાઈ મુસાફરી ! ઑફર 26 ઑક્ટોબર સુઘી
business,"કર્મચારીઓને સરકારની ભેટ, ગ્રેચ્યુઇટીની મર્યાદા વધારીને રૂ. 20 લાખ કરવામાં આવી"
tech,હાર્ટ એટેક આવ્યા પહેલા તમને એલર્ટ કરશે આ ટી-શર્ટ
business,આવનારા દસકામાં ભારતનું સૌથી ઝડપી વિકસિત અર્થતંત્ર: હાર્વર્ડ યુનિવર્સિટી
tech,"શરૂ થયો HONOR 8Cનો પહેલો સેલ, મેળવો 6 હજાર રૂપિયા સુધીનો ફાયદો"
business,ICICI બેંક મહિલાઓના સેવિંગ એકાઉન્ટ પર આપી રહી છે આ ભેટ
business,દેશમાં વાર્ષિક 85 હજાર કરોડનું ઈંધણ ટોલટેકસ પર વેડફાય છે
business,"શુક્રવારથી ત્રણ દિવસ બેંક રહેશે બંધ, આજે જ પતાવી લો જરુરી કામ"
tech,"Amazon પર ચાલી રહી છે Apple Fest, iPhone Xથી લઇને iPhone XR સુધી ભારે ડિસ્કાઉન્ટ"
entertainment,આગામી વર્ષે અર્જુન કપૂર અને મલાઇકા અરોરા કરશે લગ્ન?
business,"સેન્સેક્સમાં હાહાકાર, જોવો વીડિયો"
entertainment,"હોંગ કોંગમાં અલગ લૂક અને મસ્તીભર્યા અંદાજમાં નજર આવી યામી, જુઓ છે કોની સાથે!"
business,રિઝર્વ બેન્ક પર કબજો કરવામાં લાગી છે મોદી સરકાર: પી. ચિદમ્બરમ
business,"સસ્તી હવાઈ મુસાફરીનો ફરી અવસર, આ કંપનીઓએ નીકાળ્યો 900 રૂપિયામાં સેલ"
entertainment,રીલિઝના થોડા જ કલાકોમાં ફિલ્મ 'ઠગ્સ ઓફ હિન્દોસ્તાન' ઇન્ટરનેટ થઇ Leak
entertainment,"Gully Boy રણવીરે ફેન્સ પર મારી છલાંગ, લોકોને પહોંચી ઇજા"
business,"Toyotaએ ભારતમા લોન્ચ કરી Yaris સિડાન, કિમત 8.75 લાખ રૂપિયા"
business,દુનિયામાં ડ્રોનના બજાર પર ચીનનો કબજો
business,"દેશની અર્થવ્યવસ્થાએ પકડી રફ્તાર, એપ્રિલ-જૂન ક્વાર્ટરમાં GDP ગ્રોથ રેટ 8.2%"
entertainment,GST વિભાગે માલિક મહેશ બાબૂના બેંક ખાતાઓ કર્યા સીલ
entertainment,"નાના પાટેકર બાદ વિવેક પર તનુશ્રીનો આરોપ, કહ્યું હતું- 'ઉતારો કપડા'"
tech,આ એપથી OLA કેબ કરવા પર મળશે 100 ટકા કેશબેક
business,આગામી બે દિવસમાં બેંકોનાં કામ છે? તો આજે જ પતાવી દેજો
business,"ભાવ ગગડતા ખેડૂતોએ મજબુરીમાં જાહેર કરી સ્કીમ,""મફતમાં ખેતરમાંથી લઇ જાવ ડુંગળી"""
entertainment,VIDEO: નીતા અંબાણીએ દીકરાના રિસેપ્શનમાં કર્યો મંત્ર મુગ્ધ કરતો ડાન્સ
tech,"Asusના આ સ્માર્ટફોન પર રૂપિયા 4 હજાર સુધીનું ડિસ્કાઉન્ટ મળશે, આવી રીતે કરો ખરીદી"
business,EPFO વેબસાઇટમાંથી 2.4 કરોડ લોકોના વ્યક્તિગત ડેટાની ચોરી!
business,SBI YONO 20under20 એવોર્ડનાં નામાંકનમાં મહારાષ્ટ્ર મોખરે
business,"ખુશખબરી! 1 એપ્રિલથી PPF, NSCs, સુકન્યા જેવી બચત યોજનામાં વધારે મળશે વ્યાજ!"
tech,"હવે WhatsApp ગ્રૃપમાં બોલીને મોકલી શકશો મેસેજ, માત્ર આ યુઝર્સને થશે ફાયદો"
tech,આ ભારતીય વિદ્યાર્થીને ગૂગલે આપ્યું 1.2 કરોડનું પેકેજ
entertainment,"દીપિકા-રણવીર જોડાયા લગ્નગ્રંથીએ, પારંપરિક કોંકણી વિધિથી થયા ઇટાલીમાં લગ્ન"
entertainment,Video: અનુરાગ અને પ્રેરણાની જિંદગીમાં દખલ કરવા આવી ગઇ આ 'કોમોલિકા'
entertainment,"Shocking : કોના માટે પ્રિયંકા ચોપરા બની ગઇ બારટેન્ડર, જુઓ વીડિયો"
tech,આઇફોન યુઝર્સને વોટ્સએપના એક બગે કરી નાખ્યા હેરાન પરેશાન!
tech,"Redmi Note 7નો પહેલો સેલ આજે, Jio આપી રહ્યું છે ડબલ ડેટા અને રૂ.2400નું કેશબેક"
entertainment,PHOTOS: બોલિવૂડની હોટ સેલિબ્રિટીઝ જેઓ PETA માટે કરી ચુક્યા છે કામ
entertainment,Ace Of Spaceની આ સ્પર્ધકનો બોલ્ડ અવતાર સોશિયલ મીડિયા પર VIRAL
tech,Paytmથી ટ્રાન્ઝેક્શન કરતી વખતે આ ચાર બાબતોનું રાખો ધ્યાન
business,"રૂપિયા બાદ સરકારે સોના પર હાથ માર્યો, મહિલાઓ 500 ગ્રામ સુધી સોનું રાખી શકશે"
business,મોટી જાહેરાત: Railwayમાં નીકળશે 2 લાખથી વધારે Jobs
entertainment,Hot: ટીવીની સૌથી સેક્સી એક્ટ્રેસ નિયા શર્માએ શેર કર્યો બોલ્ડ વીડિયો અને તસવીરો
entertainment,સરોજ ખાનનું વિવાદિત નિવેદનઃ 'કાસ્ટિંગ કાઉચથી યુવતીઓને 'રોજગારી' મળે છે'
business,Jio મોબાઇલ પછી બ્રોડબેન્ડ માટે પણ લાવી રહ્યું છે ધમાકેદાર ફ્રી ઓફર
business,"Jioની દિવાળી ઓફર, Freeમાં મળી રહ્યો છે 10GB સુધી ડેટા"
entertainment,અમેરિકાના મેડમ તુસાદ મ્યુઝિયમમાં પ્રિયંકા ચોપડાનું પૂતળું મૂકાયું
tech,ફેસબુક ઉપર જાતે જ શરૂ થઇ જતા વીડિયોને આવી રીતે કરો Turn Off
entertainment,"Section 377: બોલિવૂડે વધાવ્યો SCનો ચુકાદો, જુઓ કોણે શું કહ્યું"
business,"RBIની ધિરાણ નીતિ જાહેર, જોવો વીડિયો"
tech,"આ છે દેશનું સૌથી સસ્તુ બાઈક, 1 લીટરમાં ચાલે છે 90 કિલોમીટર"
business,"ઘરબેઠા ચેક કરો પ્રોવિડન્ટ ફંડ, આ પાંચ રીતે ચેક કરો બેલેન્સ"
business,સબસિડી અને બિનસબસિડીવાળાં ગૅસ-સિલિન્ડરના ભાવમાં ઘટાડો
entertainment,"'મિલન ટોકીઝ'નું ટ્રેલર રીલિઝ, દમદાર છે અલી ફઝલના ડાયલોગ્સ અને એક્ટિંગ"
entertainment,"સાઉથની અભિનેત્રીએ કરી આત્મહત્યા, બોયફ્રેન્ડ પર મૂક્યો આરોપ"
tech,લોન્ચ પહેલા જ Redmi 5 અને  Redmi 5 Plusના ફિચર્સ થયા લીક
entertainment,"PICS: ઐશ્વર્યાને મળ્યો 'વૂમન ઓફ સબ્સટેન્સ', મસાબાએ ડિઝાઇન કરેલો પહેર્યો ડ્રેસ"
entertainment,બિગબોસની આ એક્સ-કન્ટેસ્ટન્ટે શેર કરી બિકીની તસવીર
entertainment,રણબીર-આલિયાની 'બ્રહ્માસ્ત્ર'નો લોગો અનોખી રીતે થયો લોંચ
business,PNB સ્કેમ: મેહુલ ચોકસી વિરુદ્ધ ઇન્ટરપોલે જાહેર કરી રેડ કોર્નર નોટિસ
tech,"What! ફેસબૂકને તમારા NUDE ફોટો જોઈએ, પરંતુ આ પોલિસીમાં છે ગડબડી"
entertainment,તમે જોયું જ્હોન અબ્રાહમની અપકમિંગ ફિલ્મ 'RAW'નું  પોસ્ટર?
entertainment,Video: જાહ્નવી કરી રહી છે જીદ પણ ઇશાન કરી રહ્યો છે નજર અંદાજ
entertainment,"શાહરૂખની રીલ લાઈફ દિકરીએ શેર કર્યા હોટ & બોલ્ડ PHOTOS, ઈન્ટરનેટ પર વાયરલ"
business,SBIમાં તમારૂ ખાતું હોય તો ચોક્કસ વાંચજો આ સમાચાર નહીં તો થશે મોટું નુકશાન
entertainment,"કેમ બોલિવૂડ સ્ટાર્સ ખેચાવી રહ્યાં છે 'સેનેટરી પેડ્સ' સાથે તસવીરો, જાણી લો કારણ"
entertainment,"માથામાં સિંદૂર, સફેદ સાડી અને કાળા ચશ્મા પહેરીને રેખાએ આપ્યો પોઝ"
entertainment,ભારતમાં 2 અઠવાડિયા પહેલા રિલીઝ થશે 'જુરાસિક વર્લ્ડ..' લોકોમાં જબરદસ્ત ક્રેઝ
entertainment,"રણવીર સિંહનો ધમાકો,  8 દિવસમાં જ 'ગલી બોય'ની સેન્ચુરી"
entertainment,"રહસ્ય બન્યું શ્રીદેવીનું મોત, 48 કલાકમાં ત્રણ વખત બદલાયું મોતનું કારણ"
tech,"Flipkart પર 1થી 5 નવેમ્બર 'Big Diwali' સેલ, જાણો કેટલું મળશે ડિસ્કાઉન્ટ"
tech,"Jioએ કર્યો ફરીથી ધમાકો, આ બાબતે દિગ્ગજ કંપનીઓને છોડી પાછળ"
entertainment,"હવે કંઇક આવી લાગે છે ધર્મેન્દ્રની પહેલી પત્ની, સનીએ શેર કરી માતાની તસવીર"
tech,"સેકન્ડ હેડ કાર ખરીદવા જઇ રહ્યા છો તો, આટલું રાખો ધ્યાન, નહીં તો પસ્તાશો"
tech,"આ ઓફરને એપ્લાય કરો અને રૂ.1,099માં ખરીદો Redmi Note 5 Pro"
business,"ક્યારેક દીકરીના જૂતા ખરીદવા પૈસા ન હતાં, આજે વિશ્વભરમાં કરે છે શૂઝ એક્સપોર્ટ"
tech,BSNLના 298 રુપિયાના પ્લાનમાં મળશે અનલિમિટેડ કોલ્સ અને 1GB ડેટા
business,"30 હજારનું AC મળશે 15,900 રૂ.માં, આ શહેરમાં છે શાનદાર ઓફર"
entertainment,VIDEO:જુઓ અનિલ કપૂર અને ઐશ્વર્યા રાય બચ્ચનની 'ફન્ને ખાન'નું ટ્રેલર
business,"નોટબંધીથી હીરા ઉદ્યોગમાં ભારે મંદી, વેકેશન લંબાવવું પડ્યું"
business,"નકલી બીલ બનાવી ટેક્સ બચાવનારા લોકોની હવે ખેર નથી, સરકારે શરૂ કરી તપાસ"
business,"જાણીતા ઈસ્કોન ગ્રુપ પર ITના દરોડા,અમદાવાદ-વડોદરામાં 30 જગ્યાએ એક સાથે તપાસ"
entertainment,"આ રિસોર્ટમાં રોકાયા છે 'દિપવીર', એક રૂમનું ભાડું રૂ.1 લાખથી વધુ"
entertainment,આ ભારતીય સિંગરને મળી ચુક્યો છે માઈકલ જેક્સન માટે મ્યુઝિક બનાવવાનો મોકો
entertainment,"રણબિરને જોઇને આલિયાની થઇ જાય છે આવી હાલત, કર્યો ખુલાસો"
tech,"21,000 રૂપિયાથી વધુ છે ડિસ્કાઉન્ટ, મળી રહ્યો છે એપલનો આ iphone"
entertainment,આલિયા સાથેની રિલેશનશિપને લઇને પહેલીવાર બોલ્યો સિદ્ધાર્થ મલ્હોત્રા
business,મોબાઈલ એપ લોન્ચ: એસટી બસમાં એડવાન્સ કરાવી શકાશે બુકીંગ
entertainment,બિગ બોસની પૂર્વ સ્પર્ધકે શેર કરી બોલ્ડ અને મોહક તસવીરો
entertainment,"સોનમ કપૂર પર ટ્રાફિક રૂલ તોડવાનો આરોપ, પોલીસે શેર કર્યો VIDEO"
business,આર્થિક ગ્રોથને ઝટકો! ઓક્ટોબર-ડિસેમ્બર ક્વાર્ટરમાં GDP ગ્રોથ ઘટીને 6.6%
entertainment,OMG! અરબાઝ ખાનનો સવાલ સાંભળીને જ રડવા લાગી સની લિયોન
business,માત્ર 100 ડોલરમાં ખરીદી હતી CPL ફ્રેન્ચાઇઝી : વિજય માલ્યા
business,SBI ગ્રાહક ધ્યાન આપો! ફ્રોડથી બચવા આવી રીતે ડિએક્ટિવ કરો ATM કાર્ડ
tech,આ સસ્તા પ્લાનમાં હર રોજ મળશે 3GB ડેટા અને ફ્રી અનલિમિટેડ કોલ
business,"RBI બહાર પાડશે રૂ.100ની નવી નોટ, આવી રીતે કરો અસલી-નકલીની ઓળખ"
tech,"લોન્ચ થયો દુનિયાનો પહેલો વાળી શકાય તેવો સ્માર્ટફોન, જુઓ Video"
business,સ્વિટ્ઝરલેન્ડ સરકારે જાહેર કરી બ્લેક મનીની યાદી
entertainment,"રાજનેતાના પૌત્રના પ્રેમમાં પાગલ હતી સારા અલી ખાન, કર્યો આવો ખુલાસો"
entertainment,PHOTOS:'વોગ બીએફએફ'ના સેટ પર મસ્તી કરતી જોવા મળી દીપિકા પાદુકોણ
entertainment,જ્યારે કરન જોહરે તેના શોમાં અર્જુન-મલાઇકાના સંબંધો પરથી પડદો ઉચક્યો!
entertainment,"આકાશના લગ્નમાં ગણપતિ લઈ ચાલતા નીતા અંબાણી, જાણો - તેનું મહત્વ"
entertainment,"લેક્મે ફેશન વિકમાં હસીનાઓનો જલવો, જુઓ કરિનાનો સુપર સેક્સી અંદાજ"
business,અરબોની સંપત્તિ છોડી 'સંન્યાસ' લેશે ફોર્ટિસ કો-ફાઉન્ડર?
tech,"10 હજાર રૂપિયાથી પણ ઓછામાં મળશે બ્રાન્ડેડ smart LED TV,આજે અંતિમ તક"
entertainment,"#Metoo પર બોલી શિલ્પા શિંદે - ઇન્ડસ્ટ્રીમાં બળાત્કાર થતા નથી, બધુ સહમતીથી થાય છે"
tech,"ગુરૂવારથી શરૂ થશે 'I Love Mi' સેલ, Xiaomiના આ બે ફોન પર રૂ. 3500નું ડિસ્કાઉન્ટ"
business,ઉર્જિત પટેલ પર જેટલી બોલ્યા- 'સરકારે નહોતું માંગ્યું તેમનું રાજીનામું'
entertainment,શું કોંગ્રેસની ટિકિટ પર ભોપાલથી લોકસભાની ચૂંટણી લડશે કરિના કપૂર?
entertainment,કરિના કપૂર સાથે ફિલ્મ્સમાં પરત ફરશે ઇરફાન ખાન? આવી છે ચર્ચા
business,"વેકેશનમાં ફરવા જવું થયું સહેલુ, અહી મળી રહી છે સસ્તી ફ્લાઇટ ટિકિટ"
business,ફક્ત બે વેરિએન્ટમાં મળશે CNGથી ચાલનારી Hyundai સેન્ટ્રો
tech,"NaMo App બની શોપિંગ પ્લેટફોર્મ, BJP સાથે જોડાયેલી દરેક વસ્તુ મળશે"
business,"એક ફોન કોલથી થઇ જશે તમારૂ બેંક એકાઉન્ટ ખાલી, આ રીતે બચો.."
entertainment,એવું તો શું થયું કે એક્સ હસબન્ડને મળવા પહોંચી કરિશ્મા કપૂર
business,"PNB સાથે ગાંધી, નહેરૂ અને શાસ્ત્રી કનેક્શન!"
tech,"Vivo X21 ક્યારે થશે લોન્ચ, જાણો શું છે ખાસ ફિચર્સ"
entertainment,"'બિગ બોસ'ની EX કન્ટેસ્ટંટનાં ફોટો થયા વાઇરલ, બોલ્ડનેસની હદ થઇ પાર"
business,"ઓગસ્ટ 2013 પછી રૂપિયોમાં સૌથી મોટો ઘટાડો, 18 પૈસા ગગડ્યો"
tech,"રેલવે ટિકિટ પર આ રીતે મેળવી શકો છો 100% ડિસ્કાઉન્ટ, આ છે પદ્ધતિ"
tech,ભારતમાં 3 જ્યારે USમાં 4 પાંખીયાવાળા પંખાનો કેમ થાય છે ઉપયોગ?
business,"સુરત હીરા બજારને લાગી નજર, છ મહિનામાં 100થી વધુ પાટીયા ઉતર્યા, 757 કરોડનું ઉઠમણું"
business,"28 ફેબ્રુઆરી પહેલા કરી લો આ કામ, નહીં તો ફસાઇ જશે રૂપિયા!"
entertainment,પોતાને ફિટ રાખવા પરસેવો પાડી રહી છે સારા અને સોનાક્ષી
business,જિયો પ્રાઇમ મેમ્બરશીપ માટે પડાપડી
entertainment,PHOTOS: 'ઉરી' હિરો વિકી કૌશલથી માંડી રણવીર સિંઘ સુધી બધાને પર્સનલી મળ્યા PM મોદી
entertainment,રણબીર આલિયાનાં લગ્નનાં સવાલ પર મહેશ ભટ્ટે આપ્યુ મોટુ નિવેદન
business,"બજેટના બીજા દિવસે સ્ટોક માર્કેટમાં ઉછાળો, જાણો વિગતો"
entertainment,"મલિયાલી એક્ટ્રેસ પ્રિયા પ્રકાશ વોરિયરે ફરી કરી ઇશારામાં વાત, જુઓ નવો પ્રોમો"
entertainment,"કપિલ શર્માને ભારે પડ્યું ફ્લર્ટીંગ, સલમાન ખાનને કરાઇ ફરિયાદ"
entertainment,Bigg Bossની એક્સ સ્પર્ધક આમ એન્જોય કરી રહી છે હોલિડે
business,"સાબરકાંઠા : ટામેટાના ઘટતા ભાવથી ખેડૂતો પરેશાન, ટામેટાની ખેતી પડી મોંઘી"
entertainment,"શ્રીદેવીની સાડી પહેરીને જાહ્નવીએ કરી 'મોમ'ને યાદ, લીધો માતાનો અંતિમ નેશનલ એવોર્ડ"
entertainment,"આસામમાં ફેન્સ વચ્ચે પહોંચી પ્રિયંકા, 'બિહુ' ડાંસનો વીડિયો વાયરલ"
entertainment,"'સિમ્બા'એ તોડ્યો 'ચેન્નઇ એક્સપ્રેસ'નો રેકોર્ડ, આટલા કરોડની કરી કમાણી"
tech,આ એપથી જમા કરો વીજળી બિલ અને મેળવો 175 રુપિયાનું કેશબેક
business,રિલાયન્સનો શેર ખરીદનાર થયા માલામાલ! એક વર્ષમાં આપ્યો 40% નફો
entertainment,કુંડલી ભાગ્યની આ એક્ટ્રેસે બિકીની પહેરી આપ્યો આવો પોઝ
entertainment,"વડોદરા: ગુજરાત લીટરેચર ફેસ્ટિવલમાં બોલીવુડ અભિનેત્રી વિદ્યા બાલન, જાણો શું કહ્યું ?"
tech,"દુબઈના શેખે બનાવી દુનિયાની સૌથી લાંબી SUV, જોવામાં ખુબ આક્રામક"
entertainment,"આ રીત અપનાવી મફતમાં Netflix જોઈ રહ્યા છે લોકો, કંપનીને લગાવી રહ્યા છે ચૂનો"
entertainment,"પ્રેગ્નેન્ટ છે આ સુપર મોડલ, શેર કરી પ્રેગ્નેન્સીની પહેલી તસવીર"
entertainment,દુનિયાનો સૌથી મોટો યુટ્યૂબર પણ છે એકતા કપૂરની સિરીયલનો ફેન!
entertainment,'બિગ બોસ'માં નાઇટીઝને કારણે ચર્ચામાં આવેલી અર્શી ખાન હવે ટેટૂને કારણે છવાઇ!
