entertainment,સાડીમાં જ દેખાતી 'નાગિન 3' ની એક્ટ્રેસનો જુઓ બોલ્ડ અવતાર
tech,Aadharને લઇને કંપનીઓ કરશે દબાણ તો થશે 1 કરોડ રુપિયાનો દંડ
entertainment,સાજિદ ખાનના #MeToo આરોપ અંગે પૂછાયેલા સવાલોમાં ફસાયા કિરણ ખેર અને મલાઇકા
tech,"Samsung M10, M20ની સેલ શરૂ, Jio આપી રહ્યું છે રૂ. 3,110નો લાભ"
business,દરેક બેન્કમાં ઓનલાઇન મની ટ્રાન્સફરનો ચાર્જ લેવાય છે
business,સર્જિકલ સ્ટ્રાઇક બાદ લોકો મોદી સરકારથી ખુશ: સર્વેમાં ખુલાસો
entertainment,કપિલ શર્માના હાથ પર લખ્યુ છે EX ગર્લફ્રેન્ડનું નામ. `દાદીએ' કર્યો ખુલાસો
entertainment,"નવી દુલ્હન અનુષ્કાએ મનાવી પહેલી કડવા ચોથ, જુઓ તસવીર"
entertainment,"રજનીકાંતની પુત્રી સૌંદર્યા એન્જોય કરી રહી છે હનીમૂન, શેર કરી તસવીરો"
entertainment,"Spotted: અર્જુન કપૂરની સાથે જોવા મળી મલાઇકા, રવિવારે સાથે લીધુ લંચ"
tech,Facebookના માલિક માર્ક ઝકરબર્ગ બન્યા દુનિયાના ત્રીજા સૌથી અમીર વ્યક્તિ
tech,શું તમારું બાળક સતત ઓનલાઇન રહે છે? તો માતા-પિતા આવી રીતે કરી શકે છે ટાઇમ સેટ
business,"ડીઝલ પ્રથમ વખત પ્રતિ લીટર 70 રૂપિયાને પાર, LPGની કિંમત પણ 1.49 રૂપિયા વધી"
business,"કોઇએ 500ની નોટ પર નાસ્તો કર્યો તો કોઇએ બકરીને ખાવા મુકી, સોશિયલ મીડિયામાં ધૂમ મચી, જુઓ તસ્વીરો"
business,"સેન્સેક્સમાં 509 પૉઇન્ટનું ગાબડું, નિફ્ટી 10200ની નીચે"
business,"જાણી લો Reliance digital India સેલની આ 5 જરૂરી વાત, થશે ફાયદો"
tech,Nokiaના આ સ્માર્ટફોનની કિંમતોમાં થયો ધરખમ ઘટાડો
entertainment,"રિસેપ્શનમાં સોહેલ સાથે મન મૂકી નાચ્યો કપિલ શર્મા, વીડિયો VIRAL"
tech,ખોવાઇ ગયો છે તમારો ફોન તો google mapની મદદથી આ રીતો શોધો
business,અમે ડિજિટલ ઇન્ડિયાનું સપનું પૂરું કરી રહ્યા છીએ: મુકેશ અંબાણી
entertainment,'સંજુ' જોતા ઘણીવાર આંખમાં આવશે આંસુ તો ઘણી વાર ખડખડાટ હસી પડશો
entertainment,ફિલ્મ ‘વીરે દી વેડિંગ’માં સ્વરાના બોલ્ડ સીનને હટાવાયો
entertainment,Box Office: 'પદ્માવત' અને 'પેડમેન' સામે નબળી રહી 'અય્યારી'
entertainment,શમીની પત્ની બાદ ટીવીની આ 'વહુ' વધારી રહી છે ઇન્ટરનેટનું તાપમાન
tech,"આ ફોન ખરીદવાનો આજે છેલ્લો દિવસ, જો નહી ખરીદો તો પસ્તાશો"
business,ઓછું પ્રદૂષણ ફેલાવતા ગ્રીન ફટાકડા કેવા હોય છે અને ક્યાં મળશે?
tech,પહેલી એપ્રિલે થયા છે આ ખાસ આવિષ્કાર
entertainment,સલમાન: 1000 વખત અર્પિતાને ફોન કરી પ્રિયંકાએ 'ભારત'માં કામ માંગ્યુ હતું
business,"150થી વધુ વસ્તુઓ પર ઘટ્યું GST, જીવન જરૂરિયાતની વસ્તુઓ થઇ સસ્તી"
business,"ઝાયડસ વેલનેસે રૂ. 4,595 કરોડમાં હેઇન્ઝ ઇન્ડિયાને હસ્તગત કરી"
entertainment,શહીદ જવાનોની પત્નીઓ અને ખેડૂતો માટે અમિતાભનું રૂ.2 કરોડનું દાન
tech,"આ ફોનની સાથે દર મહિને ફ્રીમા મળશે 10GB ડેટા, આજે 12 વાગ્યાથી થશે બૂક"
entertainment,સુશાંત સિંહ રાજપૂતને ડેટ કરી રહી છે સારા અલી ખાન?
entertainment,PHOTOS: રણવીર-દીપિકાએ મહેમાનોને  આપી ખાસ રિટર્ન ગિફ્ટ
entertainment,"રિયલ લાઇફમાં બોલ્ડ છે Bigg Boss 12ની આ હોટ કન્ટેસ્ટન્ટ, ફોટા થયા વાયરલ"
entertainment,આ છે મિસ યૂનિવર્સની પહેલી ટ્રાન્સજેન્ડર કન્ટેસ્ટન્ટ એન્જેલા પોંસ
entertainment,PHOTOS: પ્રેગ્નેન્સીનાં સમાચાર વચ્ચે આમ નજર આવી મીરા
entertainment,"'ધ્રૂમપાન પડેગા મહેંગા' વાળી બાળકી અત્યારે આવી લાગે છે, નહીં થાય વિશ્વાસ!"
entertainment,"#DeepVeer: કરોડોનાં છે આ લગ્ન, વાંચો દર કલાકે થઇ રહ્યો છે કેટલો ખર્ચો"
entertainment,શું  શાહરૂખ ખાને ખરેખર રાકેશ શર્માની બાયોપિક છોડી?
business,"છાણાં વેચીને આ માણસ મેળવે છે બમણો નફો, તમે પણ કમાઓ આ રીતે"
entertainment,કેન્સરગ્રસ્ત સોનાલીની હેલ્થને લઇને પતિ ગોલ્ડીનો ખુલાસો
entertainment,"બોલિવૂડ સ્ટાર્સ સાથે PMની સેલ્ફી થઈ ટ્રોલ, યૂઝરે સ્ટાર્સના કપાળે લખ્યું 'જય શ્રી રામ'"
entertainment,"PM મોદીની બાયોપિક કરશે વિવેક ઓબેરોય, 7 જાન્યુઆરીએ રિલીઝ થશે FIRST LOOK"
entertainment,"વીકએન્ડમાં 'સ્ત્રી'ની રેકોર્ડ તોડ કમાણી, ફક્ત ત્રણ દિવસમાં કમાયા આટલા કરોડ"
business,ATMમાંથી પૈસા ઉપાડવાનો વધશે ચાર્જ! પ્રતિ ટ્રાન્જેક્શન ખર્ચાશે રૂ. 20
tech,MS Wordની જગ્યાએ ગૂગલ ડોકનો ઉપયોગ કરીને મિનિટોમાં ઓછું કરો કલાકોનું કામ
entertainment,આ સિંગરે હનીસિંહ અને કિંજલ દવેનું ગીત એવી રીતે ગાયું કે થયું વાયરલ
entertainment,ક્યારેક 'ડોનર' તો ક્યારેક 'ગુપ્ત રોગી' આ છે બોલિવૂડનો 'એડલ્ટ' હીરો
entertainment,"રિલીઝ થતા જ આ પંજાબી ગીતે મચાવી ધૂમ, 5 લાખથી વધારે લોકોએ જોયો VIDEO"
business,"Flipkartની USમાં આવી રીતે થશે એન્ટ્રી, વોલમાર્ટે જણાવ્યો પ્લાન"
tech,કેવી રીતે કરી શકાશે 'JioPhone 2'નું બુકિંગ? શું છે ફોનના ફિચર્સ?
entertainment,લક્સ ગોલ્ડન એવોર્ડ: રેડકાર્પેટ પર જુઓ સ્ટાર્સની દિલકશ અદાઓ
entertainment,"'કેદારનાથ' ની નબળી કહાની છતા સારાનો ચાલ્યો જાદુ, કરી આટલી કમાણી"
tech,"હવે તમે Whatsappથી મોકલી શકશો પૈસા, જાણો ક્યારે શરૂ થશે આ સર્વિસ"
entertainment,"રજનીકાંતની પુત્રી સૌંદર્યાની રિસેપ્શન પાર્ટી, જુઓ કોણ કોણ રહ્યું હાજર"
tech,ઈનફિલ્ડને ટક્કર આપવા માટે અમેરિકાએ ભારતમાં લોન્ચ કર્યું આ બાઈક
tech,એકસરખી કિંમતવાળા રેડમી 5A અને 6Aમાં છે મોટો તફાવત
entertainment,"એક જ દિવસે બે વિધિથી પરણશે પ્રિયંકા-નિક, આજે નથી તેમનાં લગ્ન"
business,"જિયોફોન-2, JioGigaFiber લોંચઃ જાણો, AGMની 6 મોટી જાહેરાત"
entertainment,"ફેમિના 2018 એવોર્ડ્સમાં હસિનાઓનો જમાવડો, જોઇ લો તેમની અદાઓ"
entertainment,"In Pics: સૈફ-કરિનાએ શેર કર્યું ખાસ ફોટોશૂટ, આપી રહ્યાં છે કપલ ગોલ્સ"
entertainment,જાણો શું કહ્યું રાઇઝિંગ ઇન્ડિયા સમિટમાં બોલિવૂડ સ્ટાર રણવીરે
business,"પેટ્રેલ-ડીઝલ ભરાવવા માટે હવે કેશ રાખવાની જરૂર નહીં, અંગૂઠાથી થશે પેમેન્ટ"
business,"આજથી બદલાઈ ગઈ 4 વસ્તુ! બેન્કથી લઈ રેલ્વે, તમારા ખીસ્સા પર પડશે અસર"
entertainment,"અરબાઝની 'ગર્લફ્રેન્ડ' છે આ મોડલ, શેર કર્યા HOT Pics"
entertainment,"જુઓ, 25 બોલિવૂડ સેલિબ્રિટીઝની તેમનાં બાળકોની Super Cute તસવીરો"
tech,જ્યારે એપલની ઘડિયાળે બચાવી એક માણસની જિંદગી
tech,"ભારતમાં આવી 2.32 કરોડ રૂપિયાની ધાકડ SUV, 7 સેકન્ડમાં પકડે છે 100ની સ્પીડ"
tech,"Redmi 6A Sale: આજે 12 વાગે અહીંથી  મેળવો રૂ.2,200નું કેશબેક, 100 GB ડેટા ફ્રી"
business,"Reliance AGM: JioGigaTV, જિયોફોન-2 થયાં લોન્ચ, જાણો મહત્વની વાતો"
business,ટ્રાફિક નિયમોનું ઉલ્લંઘન કરશો તો તમારા ઇન્સ્યોરન્સ પર થશે આ અસર
entertainment,YearEnder2018: હજુ સુધી નથી જોઇ આ 10 ફિલ્મો તો ચોક્કસથી જોઇ લેજો!
entertainment,'ધડક'નાં પ્રમોશન માટે જાહ્નવી અને ઇશાન રિયાલિટી શોમાં પહોચ્યાં
business,"RBI વિવાદ પર બોલ્યા નાણામંત્રી, સરકાર આગળ પણ આપતી રહેશે સલાહ"
business,"GST : અફવાનું રિયાલિટી ચેક, આખરે શું છે સત્ય ? જાણો"
entertainment,ડ્રગ્સ રાખવાના આરોપમાં એક્ટર એઝાઝ ખાનની ધરપકડ
business,"પ્રભુ કરો કૃપા, ગુજરાતને શું મળશે વધુ ટ્રેન? જોવો સ્પેશિયલ અહેવાલ"
entertainment,"ઈશા ગુપ્તાએ ટ્રોલર્સને આપ્યો જવાબ, એક સાથે પોસ્ટ કર્યા 5 ફોટોઝ"
entertainment,'સેક્સી ડાયન' મોનાલિસાએ બ્લેક બિકિની પહેરી લગાડી આગ!
entertainment,આ હોટ એક્ટ્રેસે ફરી એકવાર બોલ્ડનેસની હદ કરી પાર
business,માત્ર ત્રણ કલાકમાં જ કરી દેશની સૌથી મોટી બેંકની સાઇટ હેક
business,"SBIના આ ખાસ એકાઉન્ટમાં મળશે FD જેટલું વ્યાજ, જાણો - કેવી રીતે ખુલે આ ખાતુ"
entertainment,સત્યમેવ જયતે: વર્તમાન સમયમાં ભારતને એક 'વીર'ની જરૂરત!
entertainment,'કસૌટી' ફેમ પાર્થની બર્થડે પાર્ટીમાં કેમ જોવા ન મળી કોમોલિકા?
business,મોંઘવારીનો માર હવે નહીં સહેવો પડે : જેટલી
business,"31 માર્ચ બાદ નહીં ચાલે આ 6 બેંકોનાં ચેક, નવી ચેકબૂક માટે આવી રીતે કરો એપ્લાય"
entertainment,"અવોર્ડ ફંક્શનમાં ટ્રાન્સપરન્ટ ડ્રેસ પહેરીને આવી ટીવીની આ વહુ, જુઓ હોટ તસવીર"
business,ફ્લિપકાર્ટ સંકટ: Myntraના CEO અને CFOએ પણ આપ્યું રાજીનામું
business,હોટલ જેવી સુવિધાઓ ધરાવતી ટ્રેનના આ કોચમાં તમે પણ કરી શકો છો સફર!
entertainment,સલમાનના 'KBC'હોસ્ટ કરવાની ઇચ્છા પર અમિતાભ બચ્ચને આપ્યું આવું રિએક્શન
tech,"Xiaomiએ 6,000 રૂપિયા ઓછી કરી નાખી આ એડવાન્સ ફોનની કિંમત"
entertainment,ઓનસ્ક્રીન ન્યૂડ થવા કે કો-સ્ટારને કિસ કરવા મામલે નથી એક્ટ્રેસનાં પતિને વાંધો!
tech,એક iPhone વેચીને એપલ અધધ.. રૂપિયાની કરે છે કમાણી
business,"જાણો, સૌથી સસ્તા 251ની કિંમતના સ્માર્ટ ફોનની પાંચ ખાસિયતો, જોવો તસ્વીર"
entertainment,"PM મોદી તરફથી હજુ નથી મળી કોઈ મદદ, સાયરા બાનોએ કેમેરા સામે કહ્યું પોતાનું દર્દ"
entertainment,અક્ષરા હાસનની સાથે આ એક્ટ્રેસની પણ પ્રાઇવેટ તસવીરો થઇ હતી લીક
tech,"મહિન્દ્રાએ ભારતમાં લોન્ચ કરી Mahindra XUV300, જાણો કિંમત"
tech,"WhatsAppમાં આવ્યું કમાલનું ફીચર, હવે યૂઝર્સને ચેટમાં મળશે વીડિયોની મજા"
entertainment,"રાજકુમાર રાવ ગર્લફ્રેન્ડ માટે કરે છે આ કામ, તમારી પાસે આવો બોયફ્રેન્ડ છે?"
entertainment,Juicy Link Up: અરબાઝે જોર્જિયા સાથેનાં સંબંધો પર આપ્યુ ચોકાવનારું નિવેદન
entertainment,"ફિલ્મ ‘ઠગ્સ ઓફ હિન્દોસ્તાન’નું પ્રથમ ગીત રિલીઝ, અમિતાભ, આમિરનો જલવો"
tech,Jioની નવી ઓફર: 100 રૂપિયામાં મેળવો 3 મહિના ફ્રી કોલિંગ અને 42GB ડેટા
entertainment,"Movie Review: શૂન્ય જ છે અનુષ્કા, શાહરૂખ અને કેટરિનાની 'ZERO'"
business,ચાંદી બે દિવસમાં રૂ. 1000 જયારે સોનું રૂ. 350 વધ્યું
entertainment,"'અંદાજ અપના અપના'માં નહીં હોય રણવીર-વરૂણ, પ્રોડ્યુસરનો ખુલાસો"
business,"મબલક ઉત્પાદન થતા 50પૈસાના કિલો ટામેટા,ખેડૂતોને રડવાનો વારો"
entertainment,"કપિલ શર્માનાં લગ્નની કંકોત્રીની આવી સામે, તમે પણ જુઓ એક ઝલક"
tech,"કોલેજ બેગમાં રાખેલા ફોનમાં અચાનક થયો BLAST, જુઓ તસવીર"
business,"ફોર્બ્સ ટોપ 100 યાદીમાં ભારતના માત્ર બે અરબપતિ, બિલ ગેટ્સ નંબર વન"
business,મોટી ખબર! દેશનું 2019નું બજેટ આ 5 લોકો કરી રહ્યાં છે તૈયાર
business,"'ગૂગલ ટેક્સ' એ ઓનલાઇન દુનિયામાં મચાવ્યો ખળભળાટ, જાણો"
tech,"લોન્ચ થયું WhatsAppનું ગ્રુપ કોલિંગ ફિચર, આજથી જ યૂઝર્સ કરી શકશે ઉપયોગ"
entertainment,"Hotness Alert:  'ઉતરણ'ની ઇચ્છાએ બદલ્યો તેનો લૂક, જુઓ તસવીરો"
entertainment,હવે કેવી છે સોનાલી બેન્દ્રેની તબિયત ? નણંદે જણાવ્યો હાલ
business,બજેટમાં BPL પરિવારોને શું મળી ભેટ? જોવો તસ્વીર
tech,"અમેરિકામાં 'સેલ'થી ભારતને થઈ રહ્યો છે ફાયદો, જાણો કેવી રીતે?"
business,સોફ્ટ ડ્રીન્ક પીવાથી હવે આપવો પડશે 'સ્વીટ ટેક્સ'
business,એક મહિલા જ્યારે લેભાગુઓથી છેતરાય છે ત્યારે ખુબ દુઃખ થાય છેઃઆનંદીબહેન પટેલના હસ્તે 1344મકાનોનો લકી ડ્રો
tech,"તમારા વોટ્સએપને લઈને 'ઈન્ડિયન આર્મી'એ આપ્યું એલર્ટ, થઈ જાઓ સાવધાન"
tech,"2019 Mercedes-Benz cls  ભારતમાં લોન્ચ, જાણો નવી કારની ખાસિયત"
tech,"ભારતમાં પણ 'બ્લેક ફ્રાઇડે સેલ', જાણો ક્યાં અને કઇ વસ્તુઓ પર મળશે છૂટ"
entertainment,100 કરોડ ક્લબમાં એન્ટ્રી કરશે ટાઇગરની 'બાગી-2'
business,નિયમો વિરુદ્ધ પ્રદર્શનઃ રાજકોટ સહિત સમગ્ર સૌરાષ્ટ્રમાં સોમવારે સોની બજાર બંધ
business,"Reliance Industries: માર્ચના ત્રિમાસીકમાં આવક 1.17 લાખ કરોડ, નફો રૂ. 9435 કરોડ"
business,"ગાડી અને સોનાની ખરીદી થશે સસ્તી, ટેક્સ નિયમોમાં થશે ફેરફાર"
entertainment,Viral : બોલિવૂડમાં હિટ થઇ સેલ્ફી લેતાં બાળકોની આ તસવીર
entertainment,"શું છે સલમાન ખાનનો જોધપુર કાળિયાર કેસ, જાણો સમગ્ર મામલો"
tech,"દિવસમાં 30 મીનિટ બંધ રાખો સ્માર્ટફોન, થશે આટલા બધા ફાયદા"
entertainment,Total Dhamaal:ટીઝરમાં રિતેશ-જોનીની કોમેડી હસવા મજબૂર કરશે
entertainment,"#MeToo: 'વિકી કૌશલનાં પિતા શામ કૌશલ પર આરોપ, 'મને બતાવી હતી પોર્ન ફિલ્મ'"
business,"રાજકોટઃઆરોગ્યના દરોડા,1400 કિલો અખાદ્ય કેરીનો નાસ કરાયો"
tech,"15મી સપ્ટેમ્બરથી Aadhaarનું ફેસ ઓથેન્ટિકેશન જરૂરી, શું છે નવું ફિચર?"
entertainment,"ડિસેમ્બરમાં જ 81નાં થયા કાદર ખાન, ઇન્ડસ્ટ્રીનો બદલાતો માહોલ જોઇને છોડી હતી એક્ટિંગ"
business,"ક્રેડિટ કાર્ડના છૂપા ચાર્જિસ, બેંકો આ વિશે સામેથી નથી આપતી જાણકારી"
entertainment,"કોમેડીથી ભરપૂર ફિલ્મ 'ટોટલ ધમાલ'નું ટ્રેલર રીલિઝ, જુઓ અહીં"
entertainment,"ફિલ્મ '83'માં જાણીતા યુ-ટ્યૂબરની એન્ટ્રી, આ ક્રિકેટરનું ભજવશે પાત્ર"
tech,દુનિયાની આ સૌથી ઝડપી કારની કિંમત જાણીને ચોંકી જશો
business,શેર બજારમાં તેજી : સેન્સેક્સે 24 હજાર અને નિફ્ટીએ 7300ની સપાટી વટાવી
business,Budget 2018: બજેટ બાદ આ વસ્તુઓની વધી શકે છે કિંમત
tech,"WhatsApp લાવ્યું કમાલનું ફિચર, બદલાઈ જશે ચેટિંગનો અનુભવ"
entertainment,"#MeToo: પૂનમ પાંડેનું થયું યૌન શોષણ, સૌથી મોટા વિલન પર લગાવ્યો આરોપ"
entertainment,"સંગીતમાં રણવીરે જમાવ્યો હતો માહોલ, જુઓ 'ખલી બલી' પર વરરાજાનો ડાન્સ VIDEO"
tech,17 મેના દિવસે લોન્ચ થશે OnePlus 6 એવેન્જર્સ લિમિટેડ એડિશન
business,"બજેટ વર્ષ 2016-17 : શું મોંઘું થયું, શું સસ્તું થયું? જોવો તસ્વીર"
business,"એપલ બની દુનિયાની સૌથી મોટી કંપની, માર્કેટ વેલ્યું 1 ટ્રિલિયન ડોલર"
entertainment,રિલીઝ થશે અમિતાભ બચ્ચન અને તાપસી પન્નૂની ફિલ્મ 'બદલા'નું પહેલુ સોંગ
business,ત્રણ જીબી રેમ અને દમદાર બેટરી સાથે ધૂમ મચાવી રહ્યો છે ગેલેક્સી ઓન નેક્સ્ટ
business,અર્થવ્યવસ્થાને ઝટકો! ઔદ્યોગિક ઉત્પાદન દર 17 મહિનામાં સૌથી ઓછો
business,"શેર બજારમાં ઉછાળો, નિફ્ટી પહોંચ્યો 8100"
tech,"Jio Phone 2 ખરીદવા માટે વધુ એક તક, બપોરે 12 વાગે શરૂ થશે સેલ"
tech,"2 મિનિટમાં  out of stock થઇ ગયો  Oppoનો આ સ્માર્ટફોન, જાણો હવે ક્યારે થશે સેલ"
entertainment,Cannes 2018: મલ્લિકા શેરાવત પાંજરે પુરાઇ આપ્યો ખાસ સંદેશ
business,રોજનાં ફક્ત 30 રૂપિયા ઇન્વેસ્ટ કરી આપ બની શકો છો કરોડપતિ!
