entertainment,સાડીમાં જ દેખાતી 'નાગિન 3' ની એક્ટ્રેસનો જુઓ બોલ્ડ અવતાર
business,"નીરવ મોદીના જેકેટમાં એવુ શું છે ખાસ, જેની કિંમત છે આઠ લાખ રૂપિયા"
business,નોટ નહી કરાવે ખોટઃશનિવાર અને રવિવાર બેન્કો ખુલ્લી રહેશે
business,મોબાઇલ : ઇન્ટેક્સ કંપનીએ ઓછી કિંમતમાં લોન્ચ કર્યો એક્વા એયર 2
business,"એક જ નિર્ણયથી બદલાઈ ગઈ કિસ્મત, વર્ષભરમાં ફેમિલીને કરાવ્યો કરોડોનો ફાયદો"
entertainment,"શ્રીદેવીના રાજકીય સન્માન સાથે અંતિમ સંસ્કાર, RTIમાં થયા ખુલાસા"
business,લોન ફ્રોડ કેસમાં ચંદા કોચર અને વીડિયોકોન પ્રમુખ વેણુગોપાલના ઘરે EDની તપાસ
entertainment,શું તમે જોયો 'કોમોલિકા' હિના ખાનનો બોલ્ડ અવતાર!
business,કોણ છે RBI ગવર્નર પદથી રાજીનામું આપનારા ઉર્જિત પટેલ?
business,"લગ્નમાં ગેસ્ટની સંખ્યા નક્કી કરશે દિલ્હી સરકાર, જાણો શું છે નવી પોલિસી"
entertainment,"કલાકારોની કુંડળી જોઇને કામ આપે છે એક્તા કપૂર, જુઓ તસવીરો"
business,પ્રધાનમંત્રી આવાસ યોજના ગ્રામીણમાં તમારું નામ કેવી રીતે ચેક કરશો?
tech,"ટ્વિટરે 33 કરોડ યુઝર્સને પાસવર્ડ બદલવાનું કહ્યું, તમારું નામ તો નથી ને?"
entertainment,"PHOTOS: મિસ યુનિવર્સ 2018 સ્પર્ધા, જુઓ બિકિની રાઉન્ડમાં સુંદરીઓનો જલવો"
business,"રોલ્સ રોયસ કરતા પણ મોંઘી છે આ અતરની શીશી, કિંમત જાણીને આંખો થઈ જશે ચાર!"
tech,"તૈયાર થઈ જાઓ શાઓમીના શાનદાર Note 6 Pro માટે, જાણો ક્યારે થશે લોન્ચ"
business,આ બીમારી છે? તો મફતમાં કરવા મળશે Railway યાત્રા
business,Marutiની કાર આજથી આટલા રૂપિયા સુધી થશે મોંઘી! આ કારણથી વધી કિંમતો
business,20 હજારથી વધુ કેશની લેવડ-દેવડ પર લાગી શકે છે ભારે દંડ
business,"પીએમ 13મીએ ચીન જશે, થશે મોટા વેપારી કરાર"
entertainment,"""ગેમ ઓફ થ્રોન્સ""ની 8મી સિઝન શરૂ થાય તે પહેલા તેનું આ સિક્રેટ જાણો"
entertainment,"સલમાનના ભાઇની EX ગર્લફ્રેન્ડ ઇન્સ્ટાગ્રામ પર છવાઇ, શેર કરી બોલ્ડ તસવીરો"
entertainment,"આઇટમ ગર્લ નોરા ફતેહીએ સેલિબ્રેટ કર્યો બર્થ-ડે, પાર્ટીમાં આવ્યા સ્ટાર્સ"
business,PM મોદીએ કહ્યું - 2022 સુધીમાં બધાને પાકુ મકાન મળે તે મારૂ સપનું
entertainment,ગૂગલે બોલિવૂડની આ ટોપ અભિનેત્રીઓને ગણાવી સૌથી ખરાબ!
tech,"2019માં ઓડી લોન્ચ કરશે ઇલેકટ્રીક SUV,  જુઓ કેવી છે Audi E-Tron"
business,લાઇફ બ્રાંડનો લેટેસ્ટ ફોન LYF-F1 લોન્ચઃજોવો વીડિયો
entertainment,બોલ્ડ તસવીરો લીક થતાં રાતો-રાત ચર્ચામાં આવી હતી આ અભિનેત્રી
tech,Jioના આ સૌથી સસ્તા પ્લાનમાં મળી રહ્યું છે અનલિમિટેડ ઇન્ટરનેટ અને કોલિંગ
business,"માત્ર રૂ.20માં ખોલાવવો સેવિંગ એકાઉન્ટ, મળશે તમામ બેંકિંગ સર્વિસ"
business,"અમરેલી: બાબરા માર્કેટીંગ યાર્ડમાં 150 જેટલા મજુરો હડતાળ પર, કપાસની હરાજી થઈ ઠપ"
entertainment,"સલમાને શરૂ કર્યુ '10 કા દમ'નું શૂટિંગ, ફી સાંભળીને ઉડી જશે હોશ"
entertainment,"માથું નીચે રાખી કોર્ટરૂમમાં બેસી રહ્યો સલમાન, જાણો વકીલો વચ્ચે શું થઈ દલીલ?"
entertainment,"ટ્રેડિશનલ લૂકમાં સારાએ મા સાથે કરાવ્યું ફોટોશૂટ, જુઓ Pics"
entertainment,"ફરહાન અખ્તરની અપીલ, PMની સાથે આસારામની તસવીરો ન કરો શેર"
tech,"આ છે WhatsAppના સૌથી જરૂરી ફિચર્સ, જેની યુઝર્સ આતુરતાથી જોઇ રહ્યા છે રાહ"
business,માત્ર 51 રૂપિયા આપીને જ અહીંયાથી ખરીદો બ્રાન્ડેડ કપડા
entertainment,આશા ભોસલેના આ પગલાં બાદ લતાએ તોડી નાખ્યાં હતાં તમામ સંબંધ
tech,"આ છે 2018ના ટોપ 10 સ્માર્ટફોન્સ, ખરીદશો તો પસ્તાશો નહીં"
entertainment,"રિયા ચક્રવર્તીએ શેર કરી હોટ ફોટોશૂટની તસવીરો, ફેન્સે કર્યો લાઇક્સનો વરસાદ"
business,"ઇસરો રચશે ઇતિહાસ,મેડ ઇન ઇન્ડિયા ""સ્પેસ શટલ""ના લોન્ચિંગની તૈયારી"
business,'ખોટી નીતિઓના કારણે હાર્ડવેર ક્ષેત્રમાં ભારત બીજા દેશો કરતા પાછળ'
tech,"ફુલ વિઝન ડિસ્પલે સાથે રેડમી 6 પ્રો ભારતમાં લોન્ચ, જાણો કિંમત અને ફિચર્સ"
business,Budget 2019: આખરે રેલવેને આ બજેટમાં શું મળ્યું?
business,"ભારતીય બેંકિંગ ક્ષેત્રે સૌથી મોટો કડાકો, પંજાબ નેશનલ બેંકને 5367 કરોડનું નુકશાન"
business,"ગાંધીનગરની મધુર ડેરી અને અમૂલ વચ્ચે MOU, જોવો વીડિયો"
tech,"Amazon Payથી પેમેન્ટ કરી તમે મેળવી શકો છો રૂ. 4000, જાણો - શું છે ઓફર"
entertainment,"3 વખત વધ્યુ બ્લડપ્રેશર થઇ ગભરામણ, આવી રીતે વીતી જેલમાં સલમાનની રાત"
tech,આ સ્માર્ટફોન પર મળી રહ્યું છે 6000 રૂપિયા સુધીનું ડિસ્કાઉન્ટ
entertainment,ફિલ્મ ન ચાલી તો વાઇરલ કરી દીધી Bold તસવીરો
business,હવે કરિયાણાની દુકાન અને પેટ્રોલ પમ્પ પર પણ દવાઓ વેચાશે
business,"રોજ છપાય છે 500 રૂપિયાની 80 લાખ નોટ, તો પછી કેમ છે તંગી?"
business,ડુંગળીએ રડાવ્યાઃપોષણક્ષમ ભાવ નહિ મળતા ખેડૂતોએ હરાજી અટકાવી
entertainment,રજનીકાંતની બીજી ફિલ્મ 2.Oનું ટીઝર થયુ LEAKED
tech,"હવે Facebook, Twitterથી મોકલો પૈસા, શરૂ થઇ નવી સુવિધા"
entertainment,કોની સાથે રિલેશનશિપમાં છે કૈટરીના કૈફ? પોતે જ આપી જાણકારી
business,જીસ્વાનની ખરાબ કનેકટીવિટીના પગલે ડિજિટલ પ્રોજેકટ ખોરંભે ચઢયો
entertainment,"Netflixની નવી સિરીઝમાં ઇમરાન હાશ્મી બનશે 'જાસૂસ', શાહરુખે કર્યુ સ્વાગત"
entertainment,'ભારત'માં પ્રિંયકાનો રોલ કરવા સુનીલ ગ્રોવર તૈયાર જુઓ VIDEO
business,"ઇડર તાલુકાનું આ ગામ જ્યાં એક પણ વ્યક્તિ નથી બેરોજગાર, જાણો આવી રીતે કરી સિદ્ધી હાસલ"
entertainment,"Petta સાથે ધૂમ મચાવશે રજનીકાંત, પહેલા દિવસે આટલા કરોડની કમાણી કરી શકે"
business,"આરબીઆઇએ માન્યું, અત્યાર સુધી 10 ટકાથી પણ ઓછી જુની નોટો બદલાઇ"
business,RBIએ રદ કરી દીધું એક બેંકનું લાઇસન્સ !
entertainment,આ ટીવી અભિનેત્રીનો બોલ્ડ અંદાજ થઇ રહ્યો છે વાયરલ
tech,Good News: પેન-આધારને લીંક કરવાની મુદ્દતમાં જાણો કેટલો થઈ શકે છે વધારો
business,વાઇબ્રન્ટ ગુજરાત અનેક રીતે દિશા સૂચક છે: SBI ચેરપર્સન
tech,"આજે 12 વાગ્યે શરૂ થશે જિયોફોન 2નો સેલ, મળશે કેશબેક"
business,"આનંદો: 444 રૂપિયામાં કરો હવાઇ મુસાફરી, 22-26 જૂન સુધી થશે બુકિંગ"
business,બજેટ 2016 LIVE : નાણામંત્રી અરૂણ જેટલીના બજેટમાં શું હશે? જોવો તસ્વીર
business,"અલ્હાબાદ: બેંક ઓફ બરોડાની શાખામાં મારામારી, જુઓ વીડિયો"
tech,"વોટ્સઅપના નવા પેમેન્ટ ફિચરથી, ઘરે બેઠા આ રીતે કરો પૈસા ટ્રાન્સફર"
entertainment,રણવીર સિંહ અને આલિયા ભટ્ટના કિસિંગ સીન પર ચાલી કાતર
entertainment,"તનુશ્રી બાદ સની લિયોને જણાવી આપવીતી, મળ્યા હતા આવા પ્રસ્તાવ"
business,"1 જૂનથી બદલાશે PF ઉપાડના નિયમો, શું છે નવા નિયમો? જાણો"
business,"ટાટા મિસ્ત્રી જંગ: મિસ્ત્રી બોલ્યા-લોકોની છે ટાટા, ટાટાનો જવાબ મિસ્ત્રીએ કરાવ્યું ઘણું નુકશાન"
business,"ફ્રાંસના અર્થશાસ્ત્રીએ મોદી સરકારના ભરપેટ વખાણ કર્યા, જાણો શું કહ્યું?"
entertainment,PHOTOS:તનુશ્રી ઉપરાંત બોલિવૂડની આ હિરોઇનો બની છે છેડતીનો શિકાર
entertainment,"મોડલે બિચ પર વિતાવ્યો દિવસ, મેકઅપ વગરની તસવીર કરી શેર"
entertainment,દાદાસાહેબ ફાળ્કે એક્સેલન્સ અવોર્ડથી નવાઝવામાં આવશે અનુષ્કા
entertainment,#10YearChallenge મલાઇકા અરોરાએ એવી તે શું ભૂલ કરી કે  ફેન્સે ઉડાવી મજાક?
tech,"15 નવેમ્બરે નવા આવતારમાં આવી રહ્યો છે OnePlus 6T, જુઓ Video"
business,"મોદીના માસ્ટર પ્લાનનો કમાલ, વિદેશીઓ બનાવશે ભારતીયોને માલામાલ"
business,"જેક માની નિવૃત્તિની ખબર છે ખોટી, આજે કરશે તેમનો ઉત્તરાધિકારી જાહેર"
business,"Paytmએ શરૂ કરી નવી સ્કીમ, બેન્કની FDથી વધારે મળશે નફો"
business,જાણો કેવી રીતે બનશો જિયો પ્રાઇમ મેમ્બરશિપનો હિસ્સો
entertainment,"પ્રખ્યાત ભજન ગાયક વિનોદ અગ્રવાલનું નિધન, બે દિવસથી વેન્ટિલેટર પર હતા"
tech,"આ કંપનીએ રજૂ કર્યો જબરદસ્ત પ્લાન,  90 દિવસ માટે કોલિંગ ફ્રી"
entertainment,પ્રિયંકા ચોપડાએ આટલા કરોડમાં વેચી તેમના લગ્નની તસવીરો!
business,શેરબજારના વ્યાવસાયિકો માટે ખુશખબર! LIC આપશે 150 રૂપિયામાં 1 લાખનું વીમા કવર
business,"PAN કાર્ડના નિયમમાં આજથી મોટો ફેરફાર, શરૂ થઈ એક નવી સેવા"
business,"પોતાનો બિઝનેસ કરવાની તક, માત્ર રૂ. 599માં કોર્સ કરાવે છે સરકાર"
tech,આ 6 સ્ટેપ્સ ફોલો કરી મોબાઇલમાં ડાઉનલોડ કરો E-Aadhaar કાર્ડ
entertainment,Video: 2 મિનિટ 10 ખબર: બાહુબલીની પહેલાની કહાની માટે વેબ સીરીઝ
business,"બેંકોના મર્જરથી કર્મચારીઓમાં ફફડાટ, વાંચો શું વિચારી રહ્યાં છે ખાતા ધારકો"
business,"સરકારની રાહત પછી પણ પેટ્રોલ-ડીઝલના ભાવમાં આજે વધારો, જાણો તમારા શહેરનો ભાવ"
entertainment,"પૈસાનાં નશામાં પ્રિયંકા ભૂલી તેનું જ ઘર, પાડોસીઓએ લગાવી લાઇટ્સ"
entertainment,Revealed : પત્ની ગૌરી ખાનના હાથની આ ડિશનો દિવાનો છે શાહરૂખ
tech,"લોકોએ શોધી કાઢ્યું iPhoneનું 'છૂપું' ફિચર, ટ્વિટર પર જોરશોરથી ચર્ચા"
entertainment,"સમુદ્ર કિનારે બિકિનીમાં જોવા મળી મૌની રોય, ફોટોઝ VIRAL"
business,સેન્સેક્સમાં 1000થી વધુ અને નિફ્ટીમાં 380 પોઈન્ટનો કડાકો
entertainment,ટીવીની સૌથી હોટ એક્ટ્રેસે ફરી એકવાર શેર કરી બોલ્ડ તસવીર
business,લ્યો બોલો! પાયલોટોની અછતને કારણે Indigoએ રદ કરી 130 ફ્લાઇટો
business,"PM મોદી દ્વારા નાના વેપારીઓને દિવાળીની ગીફ્ટ, લોન લેવા વ્યાજમાં મળશે 2% છૂટ"
entertainment,"પાકિસ્તાનમાં જોવા મળ્યો સલમાન ખાનનો હમશક્લ, વીડિયો વાયરલ"
tech,"દિવાના બનાવવા આવી રહી છે આ આક્રમક બાઇક, લૂક્સ છે દમદાર"
entertainment,"સારા ખાને બિકિની ફોટા કર્યા શેર, ટ્રોલર્સે કહ્યું, 'તમે મુસ્લિમ છો કંઈક તો શરમ કરો'"
business,"રેલવેની ખાસ ઓફર: વેટીંગ ટિકિટ હોવાથી પણ મળશે કન્ફર્મ સીટ, જાણો કેવી રીતે"
business,રેલવેની ખાસ સ્કિમ: વેઈટિગ ટિકિટ હોવાં છતાં મળશે કન્ફર્મ સીટ
business,"ટૂંક સમયમાં 100 રૂપિયાની નવી નોટ આવશે, ફાટવા-તૂટવાની ચિંતા જ નહીં"
tech,"Swiftનું સ્પોર્ટ્સ વર્ઝન જલદી થઇ શકે છે લોન્ચ, આ કારને આપશે ટક્કર"
tech,"શું તમે જાણો છો, એક ફોન પર કેટલું કમાય છે સેમસંગ, એપલ જેવી કંપનીઓ"
entertainment,"હોલિવૂડ ફિલ્મ 'ધ નન'ની રેકોર્ડ બ્રેક કમાણી, પહેલા અઠવાડિયે કમાયા 943.2 કરોડ રૂપિયા"
entertainment,તનુશ્રી વિવાદ: હવે રાખી સાવંતે માંગ્યા 50 કરોડ રૂપિયાનું વળતર
entertainment,શું પ્રિયંકા પ્રેગનેટ છે? માતા મધુ ચોપડાએ કર્યો ખુલાસો
entertainment,"ખલનાયક 'શંકર દાદા'નું નિધન, બે દિવસ બાદ ફ્લેટમાં મળી લાશ"
tech,"WhatsAppએ ભારતમાં લોન્ચ કરી સ્ટાર્ટઅપ ઇન્ડિયા ગ્રાન્ડ ચેલેન્જ, મળશે 1.8 કરોડ"
business,"SBI ગ્રાહક ધ્યાન આપો! બેન્કે કર્યો મોટો ફેરફાર, નહી જાણો તો ફંડ ટ્રાંસફરમાં થશે પ્રોબલમ"
entertainment,"સોનાક્ષીએ Amazon પરથી કિંમતી હેડફોન મંગાવ્યા, જોઈ લો કંપનીએ શું મોકલ્યું!"
entertainment,PHOTOS: 'વિરે દી વેડિંગ'ની સ્પેશલ સ્ક્રિનિંગમાં ઉમટ્યુ બોલિવૂડ
entertainment,શ્રીદેવી માટે તાજમહેલ બનાવવા માંગતા હતા બોની કપૂર ...
entertainment,"શાહરૂખ કરતાં પણ વધુ દિલદાર છે આર્યન ખાન, જુઓ VIDEO"
entertainment,"સોનમ કપૂરનાં લગ્નની ફાઇનલ તારીખ જાહેર, મહેમાનોનું લિસ્ટ પણ થયુ તૈયાર"
entertainment,Bday: શ્રીદેવીની યાદમાં જુઓ તેમની કેટલીક ખાસ પહેલાં ન જોયેલી તસવીરો
business,"ટ્રેનમાં રિઝર્વેશન પહેલા જાણી લો આ 7 નિયમ, હંમેશા રહેશો ફાયદામાં..."
business,"હજુ સસ્તા થશે ઘર, બિલ્ડર્સ પર અંકુશ મૂકવા સરકારનો બીજો મોટો નિર્ણય"
tech,Gmail યૂઝર્સ માટે આવી રહ્યું છે શાનદાર ફિચર!
tech,Google I/O 2018: જો Gmail યુઝ કરી રહ્યા છો તો તમને ખુશ કરી દેશે ગૂગલનો આ નિર્ણય
business,"લાખો રૂપિયા કમાવવાની સરળ રીત, જોબ છોડી કરો આ કામ!"
entertainment,Video : બાહુબલીમાં નજરે પડનાર એક્ટ્રેસે કર્યો એવો બેલે ડાન્સ કે થઈ ગયો વાયરલ
tech,જુઓ MWC 2019માં લોન્ચ થનારા સ્માર્ટફોનનું લિસ્ટ
entertainment,'ધ કપિલ શર્મા શો' બાદ સલમાન ખાન લાવશે નવો ટીવી શો
entertainment,આ વર્ષે પણ પ્રખ્યાત પુસ્તકો પરથી બનશે ફિલ્મો ...
entertainment,B'day: આ એક્ટ્રેસ ફક્ત તેની બોલ્ડ ઇમેજને કારણે લોકોમાં જાણીતી છે
entertainment,આ પાકિસ્તાની એક્ટ્રેસને પોતાના જન્મ દિવસે મળ્યા ખરાબ સમાચાર...
tech,"ખરીદો આ સસ્તા ગેજેટને, ઘરમાં મચ્છર, ઉંદર અને કોકરોચથી મળશે છુટકારો"
entertainment,હવે આ એક્ટ્રેસ પર ફિલ્માવવામાં આવ્યો માસ્ટરબેશન સીન
business,"Airtelનો નવો પ્લાન લોન્ચ, 48 દિવસ સુધી બધુ જ FREE"
business,"હવે, 15 કરોડથી ઓછા વેપારમાં એક્સાઇઝ ડ્યુટી નહીં ભરવી પડે"
tech,"આકાશમાં દેખાશે મેડ ઈન ઈન્ડિયા વિમાન, HAL દ્વારા કરાયુ છે સ્વદેશી વિમાનનું નિર્માણ"
business,"આવું છે આકાશ અંબાણીના લગ્નનું કાર્ડ, જુઓ VIDEO"
entertainment,"ક્રિતિ સેનને ખરીદી રૂપિયા  1 કરોડની આ કાર, જાણો શું છે ખાસિયત"
business,નોટબંધી: જુની નોટ એક જ વાર જમા કરવાનો નિર્ણય આરબીઆઇએ પરત ખેંચ્યો
business,"ફેબ્રુઆરીથી TV જોવાનું થઈ જશે સસ્તુ, જાણો - તમામ ચેનલના ભાવ, કેટલો થશે ખર્ચ"
tech,શું તમે જાણો છો કે Whatsapp પર સૌથી વધુ વાત કોની સાથે કરો છો? નહીં તો જાણો
tech,"8 માર્ચથી શરૂ થશે Redmi Note 5ની ઓફલાઈન ડિલીવરી, પ્રી-બુકિંગ શરૂ"
business,Budget 2019 : તસવીરોમાં જુઓ ખેડૂતો માટે શું મોટી જાહેરાત કરવામાં આવી
entertainment,Oscar 2019: રેડ કાર્પેટ પર જોવા મળ્યો રણવીરનો 'ભાઇ' બિલી
business,"મુકેશ અંબાણી સતત 11મા વર્ષે સૌથી અમીર ભારતીય, જાણો ટોપ 10ની યાદી"
business,"જ્યારે દેશમાં રૂપિયા એક લાખની નોટ ચાલતી હતી, જાણો તેની સાથે જોડાયેલી રોચક વાતો"
business,આજે રાતે 10 વાગ્યા સુધી 500 અને 1000 રૂપિયાની જુની નોટો સ્વીકારાશે
entertainment,"7 વર્ષની થઈ અભિ-એશની આરાધ્યા, જુઓ - આરાધ્યાની Cute તસવીરો"
business,"ભાવનગરઃ ખેડૂતોને દાજ્યા પર દામ,યાર્ડમાં રાખેલી ડુંગળી માવઠામાં પલડી ગઇ"
business,PF એકાઉન્ટ તમને બનાવી શકે છે કરોડપતિ!
